{
  "schemaVersion": 1,
  "id": "11111111-1111-4111-8111-111111111111",
  "make": "Synthetic",
  "model": "Fixture only",
  "kind": "proposed-redesign",
  "coverage": "partial",
  "keyRange": {
    "lowest": 60,
    "highest": 62
  },
  "source": "Invented test data; not suitable for piano work.",
  "contributors": [
    "Test fixture"
  ],
  "license": "CC-BY-4.0"
}
